City,Latitude,Longitude,IATA_Code,Country,Island,Capital,EU,Schengen,City_Description,City_To_Dos,Food_to_try,City_Cost,Population
Copenhagen,55.68672,12.570072,CPH,Denmark,yes,yes,yes,yes,"Copenhagen, the effortlessly cool Danish capital, is a masterclass in Scandinavian chic. This compact city packs a mighty punch with its cutting-edge design scene, world-renowned culinary hotspots, and eco-friendly ethos. Cycle along the picturesque harbor front, past the iconic Little Mermaid statue, before diving into the trendy Meatpacking District for craft beers and inventive small plates. Get your culture fix at the striking Louisiana Museum of Modern Art, then hit up the fairytale-like Tivoli Gardens for a shot of nostalgia. With its impeccable blend of old-world charm and forward-thinking attitudes, Copenhagen is the poster child for Nordic living – and trust us, you'll want in on the action.","• Indulge in Nordic gastronomy at Noma, the two-Michelin-starred restaurant that put New Nordic cuisine on the map
• Take a dip in the crystal-clear waters of Islands Brygge Harbour Bath, a urban swimming spot with five pools and diving towers
• Hop on a bike and cruise down Copenhagen's coolest street, Jægersborggade, lined with indie boutiques and cozy cafés
• Lose yourself in the psychedelic light installations at Superkilen, a surreal urban park in multicultural Nørrebro
• Sip craft cocktails at Ruby, a swanky speakeasy hidden behind an unmarked door in a 19th-century townhouse","1. Smørrebrød at Aamanns 1921 - their seasonal herring with cherry tomatoes and dill is a must-try

2. New Nordic tasting menu at Noma - if you can snag a reservation, the fermented grasshopper sauce is mind-blowing

3. Hotdog from Den Økologiske Pølsemand - grab their spicy beef sausage with crispy onions and house-made remoulade

4. Kanelsnegle (cinnamon roll) from Meyers Bageri - get there early for these gooey, cinnamon-packed beauties

5. Fiskefrikadeller (fish cakes) at Torvehallerne food market - try Hav's version with remoulade and pickled cucumber",,"1,308,000"
Corfu,39.59134,19.859619,CFU,Greece,yes,no,yes,yes,"Corfu, the emerald jewel of the Ionian Sea, is a sun-soaked paradise that effortlessly blends history, culture, and laid-back island vibes. This Greek stunner boasts a UNESCO-listed Old Town, where narrow cobblestone streets wind between Venetian-style buildings in a palette of ochre and sienna. By day, bronzed bodies sprawl across golden beaches like Glyfada and Paleokastritsa, while come evening, the town's countless tavernas buzz with the clink of ouzo glasses and the aroma of grilled octopus. Don't miss the epic views from the 13th-century Angelokastro fortress or the chance to channel your inner empress at the Achilleion Palace. Whether you're here for the pulsating nightlife of Kavos or the serene olive groves of the interior, Corfu serves up a slice of Mediterranean magic that's impossible to resist.","• Sip on kumquat liqueur while people-watching at the Liston, Corfu Town's swanky Parisian-style arcade
• Wander through the labyrinthine alleyways of Campiello, stopping to admire hidden Byzantine churches and pastel-hued mansions
• Channel your inner royalty with a visit to the opulent Achilleion Palace, complete with lush gardens and Achilles statues galore
• Dive into crystal-clear waters at the secluded Rovinia Beach, accessible only by boat or a scenic hiking trail
• Feast on traditional Corfiot dishes like sofrito and pastitsada at the family-run taverna To Fagopotion in the charming village of Doukades","1. Sofrito: Succulent veal cutlets pan-fried in a garlicky white wine sauce, served with a side of fluffy rice pilaf. Head to Elizabeth's in the Old Town for the real deal.

2. Bianco: A moreish local pasta dish featuring bucatini tossed with a creamy sauce of Corfu butter, grated kefalotyri cheese, and a generous crack of black pepper. Try it at Klimataria taverna.

3. Pastitsada: Tender beef or rooster slow-cooked in a rich tomato sauce spiced with cinnamon, cloves, and bay leaves, served over thick pasta. Nikos & Maria in Benitses does it best.",,"32,000"
Cork,51.89708,-8.465467,ORK,Ireland,no,no,yes,no,"Cork, Ireland's second city, is a vibrant hub that punches well above its weight. This compact metropolis along the River Lee boasts a perfect blend of history and hipster cool. Wander through the English Market, a food lover's paradise since 1788, before hitting the trendy bars of MacCurtain Street. The revamped docklands area is now home to sleek offices and funky cafes, while the hilly northside offers panoramic views and charming local pubs. Cork's thriving arts scene, showcased in venues like the Crawford Art Gallery and the Triskel Arts Centre, gives the city a cultural edge that rivals European hotspots. With its friendly locals (known for their distinctive sing-song accent), exciting culinary landscape, and lively festival calendar, Cork is the kind of place that'll have you planning your return visit before you've even left.","• Sip on a velvety pint of Murphy's at the iconic Sin É pub, where live trad sessions set the perfect backdrop for a cozy evening
• Brave the Shandon Bells & Tower, climbing 132 steps for panoramic city views before trying your hand at ringing the 18th-century bells
• Feast on artisanal treats at the English Market, making sure to sample Ó Conaill's addictive drinking chocolate and Tom Durcan's spiced beef
• Channel your inner medieval lord at the recently restored Elizabeth Fort, complete with a cheeky cannon-firing demonstration (weekends only)
• Get your culture fix at the Crawford Art Gallery before heading next door to indulge in Nash 19's legendary lemon tart – trust us, it's life-changing","1. Saucy slow-cooked beef cheeks on a bed of creamy champ at Market Lane – pure comfort on a plate.

2. The legendary spiced beef sandwich at the English Market's Farmgate Café – a Cork Christmas tradition any time of year.

3. Smoky wood-fired pizzas topped with local ingredients at Burnt Pizza – their nduja and honey combo is a game-changer.",,"210,000"
Craiova,44.31902,23.796561,CRA,Romania,no,no,yes,yes,"Craiova, Romania's sixth-largest city, is a hidden gem in the country's southwest that's begging to be explored. This vibrant university town boasts a delightful mix of old-world charm and youthful energy. Stroll through the historic center, where you'll find the stunning art nouveau Prefect's Palace rubbing shoulders with hip cafes and buzzing bars. Don't miss the lush Romanescu Park, one of Europe's largest urban green spaces, perfect for a picnic or a lazy afternoon. Culture vultures will love the Craiova Art Museum, housed in the opulent Dinu Mihail Palace, while foodies can indulge in hearty Oltenian cuisine at traditional restaurants. With its laid-back vibe and unexpected treasures, Craiova is the perfect off-the-beaten-path destination for travelers looking to experience authentic Romanian life.","• Soak in the grandeur of Craiova's architectural crown jewel, the Art Museum, housed in the opulent 19th-century Jean Mihail Palace
• Catch a world-class performance at the Elena Teodorini Opera and Operetta Theatre, a neoclassical gem in the heart of the city
• Stroll through the lush Romanescu Park, marveling at its whimsical bridges and enchanting Suspended Castle
• Dive into Oltenia's rich history at the Museum of Oltenia, featuring an eclectic mix of archaeological treasures and folk art
• Sip on locally-brewed craft beer at Berarria Puskin, a hip watering hole that's breathing new life into Craiova's nightlife scene","1. Sarmale cu mămăligă at Hanul Craiovei: Dive into these hearty cabbage rolls stuffed with minced meat and rice, served with creamy polenta – a local favorite that'll warm your soul.

2. Craiova-style beef salad at Restaurant Bulevard: This zingy twist on the classic Romanian beef salad comes packed with tender meat, pickles, and a secret blend of spices that'll have you coming back for more.

3. Papanași at Taverna Maurilor: Sink your teeth into these indulgent cheese doughnuts, drizzled with sour cream and homemade blackberry jam – a sweet treat that's pure Oltenian comfort food.",,"250,000"
Crawley,51.11034,-0.180109,LGW,United Kingdom,no,no,no,no,"Nestled in the heart of West Sussex, Crawley is a vibrant town that packs a surprising punch for savvy urbanites. This former New Town has shed its post-war blues and emerged as a diverse hub of culture and commerce. Gatwick Airport's proximity lends an international flair, while the High Street's mix of chain stores and quirky independents keeps shoppers on their toes. Don't miss the Hawth Theatre for cutting-edge performances, or the tranquil Tilgate Park for a leafy escape. Foodies will relish the eclectic restaurant scene, from hip burger joints to authentic curry houses. With its blend of modern amenities and historical charm, Crawley offers a uniquely British slice of life that's well worth exploring.","• Catch a blockbuster at Crawley Cineworld's IMAX screen, then hit the adjacent Hollywood Bowl for a strike-filled evening of neon-lit bowling

• Get your adrenaline pumping at the indoor Go Ape Crawley, tackling high ropes and zip lines in the converted Crawley Leisure Park warehouse

• Sip on craft beers and tuck into gourmet burgers at The Brewery Shades, a hip micropub in the heart of Crawley's historic High Street

• Lose yourself in nature at Tilgate Park, exploring its walled garden, lakes, and Go Ape treetop adventure course before meeting exotic creatures at the animal centre

• Step back in time at the Crawley Museum, housed in The Tree, a quirky half-timbered building, to uncover the town's transformation from sleepy market village to new town marvel","1. The ""Crawley Crusher"" burger at Sage Vegan Café – a towering plant-based masterpiece that'll convert even the most dedicated carnivores

2. Authentic Bangladeshi-style king prawn bhuna at Zari Restaurant – swimming in a rich, fragrant sauce that'll have you licking the plate clean

3. The ""Full Gatwick"" breakfast at Tilgate Bakery – a gut-busting fry-up that'll fuel you for a day of exploring (or recover from a night out)",,"113,000"
Crotone,39.08062,17.127196,CRV,Italy,no,no,yes,yes,"Crotone, a hidden gem on Italy's Calabrian coast, packs a punch with its blend of ancient allure and laid-back Mediterranean charm. This sun-soaked city boasts a history stretching back to Greek times, evident in its impressive archaeological museum housed in the 16th-century Castello di Carlo V. Beach bums will fall head over heels for the pristine stretches of sand lining the Ionian Sea, while foodies can indulge in locally-caught seafood and Calabrian specialties in the bustling old town. Don't miss the iconic Capo Colonna, home to the sole standing column of the ancient Temple of Hera Lacinia – it's the stuff of postcards and provides the perfect backdrop for your holiday snaps. With its off-the-beaten-path vibe and authentic Italian atmosphere, Crotone is the ideal spot for travelers seeking substance over tourist traps.","• Explore the ancient ruins of Capo Colonna, home to the lone standing column of the Temple of Hera Lacinia
• Dive into Calabrian cuisine at Le Chicche di Zia Rosa, savoring their legendary 'nduja-stuffed arancini
• Wander through the labyrinthine alleys of the medieval old town, stopping to admire the 16th-century Cathedral
• Catch a sunset at the picturesque Lungomare Cristoforo Colombo, cocktail in hand at the trendy Beach Club 212
• Get your culture fix at the National Archaeological Museum of Crotone, marveling at the treasure trove of Magna Graecia artifacts","1. Nduja-stuffed zucchini flowers at Ristorante La Tavernetta: This local favorite takes delicate squash blossoms and fills them with spicy, spreadable Calabrian sausage for a flavor explosion.

2. Sardella-topped bruschetta at Osteria Pane e Vino: This rustic trattoria serves up crispy bread slathered with sardella, a fiery local condiment made from baby sardines and hot peppers.

3. Licorice gelato at Gelateria Sottozero: Cool off with a scoop of this uniquely Calabrian treat, featuring the intense flavor of local licorice root.",,"60,000"
Cuneo,44.38963,7.547901,CUF,Italy,no,no,yes,yes,"Nestled in the foothills of the Italian Alps, Cuneo is a hidden gem that packs a punch for its size. This charming Piedmontese city boasts a striking backdrop of snow-capped mountains and rolling hills, giving it an almost fairytale-like quality. The heart of Cuneo is its expansive Piazza Galimberti, a vast open square lined with elegant porticoed buildings and buzzing cafes. Foodies, take note: Cuneo is famous for its chocolates and chestnuts, while the surrounding region is a treasure trove of truffles and fine wines. With its blend of outdoor adventures, cultural attractions, and mouthwatering cuisine, Cuneo offers a quintessential Italian experience without the tourist crowds. Don't miss the opportunity to wander through the atmospheric old town, where narrow medieval streets and baroque churches transport you back in time.","• Wander through the charming Contrada Mondovì, stopping to admire the pastel-hued medieval buildings and pop into quirky boutiques

• Indulge in a truffle-tasting experience at Tartuflanghe, sampling the prized white truffles Cuneo is famous for

• Take a thrilling ride on the historic Cuneo-Ventimiglia railway, soaking in breathtaking views of the Maritime Alps

• Catch a performance at the stunning Art Nouveau Teatro Toselli, a hidden gem of Italian architecture

• Join locals for an aperitivo at Piazza Galimberti, sipping on a Bicerin while people-watching in the city's vibrant heart","1. Ravioli al plin: These tiny, pinched pasta pockets stuffed with roasted meat and bathed in a sage-butter sauce are a Cuneo specialty you can't miss.

2. Bagna càuda: A warm, garlicky dip made with anchovies and olive oil, perfect for dunking local veggies. It's basically Cuneo's answer to fondue.

3. Castagnaccio: A dense chestnut flour cake studded with pine nuts and rosemary. It's not overly sweet, making it the ideal afternoon pick-me-up with an espresso.",,"55,456"
Dalaman,36.76653,28.800959,DLM,Turkey,no,no,no,no,"Dalaman, a hidden gem on Turkey's southwestern coast, is where laid-back Mediterranean vibes meet adventure-seeker paradise. This sun-soaked town might be best known for its airport, but savvy travelers know it's so much more than a gateway. With its pristine beaches, crystal-clear waters, and lush landscapes, Dalaman is the perfect base for exploring the Turkish Riviera. By day, hit the Dalyan mud baths for a natural spa experience, or take a boat trip to spot loggerhead turtles. As night falls, the town comes alive with bustling restaurants serving up mouthwatering local cuisine. Whether you're after relaxation or thrills, Dalaman delivers both in spades – and without the crowds of its more famous neighbors.","• Cruise the Dalyan River on a traditional wooden gület, stopping to marvel at the ancient Lycian rock tombs carved into the cliffs
• Slather yourself in mineral-rich mud at the outdoor spa of Dalyan Çamur Banyoları, said to take years off your skin
• Spot loggerhead turtles and enjoy a seafood feast at secluded İztuzu Beach, a protected nesting ground for these endangered creatures
• Explore the eerie ruins of ancient Kaunos, including a well-preserved Roman theatre with sweeping views of the delta
• Indulge in a farm-to-table feast at Yeners Place, where Chef Yener whips up Turkish delights using ingredients from his own organic garden","1. Gözleme at Göcek Marina: Sink your teeth into these crispy, hand-rolled flatbreads stuffed with spinach and feta, grilled to perfection by local women at the waterfront.

2. Kabak tatlısı from Çınaraltı Restaurant: This traditional pumpkin dessert, drizzled with tahini and walnuts, is a sweet revelation you won't find back home.

3. Fresh sea bream at Sardunya Restaurant: Caught daily from the turquoise waters of the Mediterranean, this grilled fish is served with a squeeze of lemon and a side of rocket salad.",,"10,000"
Debrecen,47.53140,21.625978,DEB,Hungary,no,no,yes,yes,"Debrecen, Hungary's second-largest city, is a vibrant hub that perfectly blends history and modernity. This eastern Hungarian gem boasts the stunning Great Reformed Church, affectionately known as the ""Calvinist Rome,"" which dominates the skyline with its impressive neoclassical architecture. Foodies will rejoice at the bustling Nagyerdei Terrace, where hipster cafes and trendy bars serve up local delicacies alongside craft beers. Culture vultures can get their fix at the MODEM Centre for Modern and Contemporary Arts, showcasing cutting-edge exhibits in a sleek, industrial space. For a touch of nature, the sprawling Nagyerdő (Great Forest) offers a lush escape, complete with a picturesque lake and thermal baths. Don't miss the annual Flower Carnival in August, when the streets burst into a riot of color and music. Debrecen may fly under the radar, but it's a city that's sure to captivate with its charm and energy.","• Soak up the thermal waters and indulge in a mud treatment at the art nouveau Aquaticum Spa, a true oasis in the heart of the city

• Catch a thrilling handball match featuring the local heroes, DVSC, at the state-of-the-art Főnix Hall

• Take a leisurely stroll through the Great Forest (Nagyerdő), stopping to admire the whimsical musical fountain and grabbing a lángos at one of the nearby food stalls

• Get your culture fix at MODEM, Debrecen's cutting-edge contemporary art center, known for its provocative exhibitions and sleek industrial design

• Sample the local firewater, Pálinka, at Roncs Bár, a quirky ruin pub adorned with salvaged car parts and retro memorabilia","1. Debreceni páros: Sink your teeth into this smoky, paprika-laced pork sausage, grilled to perfection and served with a dollop of tangy mustard and crusty bread.

2. Slambuc: A hearty shepherd's stew that'll warm your soul, featuring chunks of speck, potatoes, and pasta, slow-cooked in a cauldron over an open fire.

3. Kürtőskalács: Get your hands on this chimney cake, a spiral of sweet dough roasted over charcoal and dusted with cinnamon sugar – pure street food heaven.",,"200,000"
Denizli,37.78332,29.084483,DNZ,Turkey,no,no,no,no,"Nestled in Turkey's Aegean region, Denizli is a vibrant city that seamlessly blends ancient history with modern flair. Known for its gleaming white travertine terraces at nearby Pamukkale, this bustling metropolis offers more than just Instagram-worthy backdrops. Foodies will swoon over the local culinary scene, where traditional mezes and succulent kebabs reign supreme. Culture vultures can lose themselves in the ruins of Hierapolis or dive into the city's thriving textile industry at the bustling bazaars. With its lively student population and burgeoning café culture, Denizli serves up a perfect cocktail of Turkish charm and contemporary cool. Whether you're soaking in thermal springs or sipping on robust Turkish coffee, this underrated gem is sure to leave you buzzing.","• Soak in the otherworldly landscape of Pamukkale's cotton-white travertine terraces, then take a dip in the mineral-rich thermal pools
• Wander through the well-preserved ruins of ancient Hierapolis, making sure to catch the sunset at the Roman theatre
• Sample local flavors at the bustling Kaleiçi Çarşısı market, nabbing some hand-woven textiles and artisanal copper goods while you're at it
• Get your adrenaline fix with a tandem paragliding flight from the towering Babadag Mountain, offering breathtaking views of the Aegean coast
• Dive into Denizli's café culture at the hip Çınar Meydanı square, sipping Turkish coffee and people-watching under the shade of century-old plane trees","1. Tarhana çorbası: This hearty, tangy soup made from fermented grains and yogurt is a local staple. Slurp it up at Denizli Köftecisi for an authentic taste.

2. Denizli kebabı: Tender, spiced lamb skewers grilled to perfection. Head to Çardak Ocakbaşı for the real deal, served with fluffy pide bread and grilled vegetables.

3. Keşkek: A stick-to-your-ribs wheat and meat stew that's pure comfort food. Try it at Hacı Şerif, where they've been perfecting the recipe for generations.",,"300,000"
Derry,54.99787,-7.321306,LDY,United Kingdom,no,no,no,no,"Derry, or Londonderry if you're feeling formal, is a compact city with an outsized personality on Northern Ireland's north coast. Straddling the River Foyle, this walled wonder packs a punch with its rich history and vibrant cultural scene. The famous 17th-century city walls offer a picturesque stroll with panoramic views, while the Peace Bridge symbolizes the city's journey towards reconciliation. Derry's streets buzz with an eclectic mix of traditional pubs, hip cafes, and innovative restaurants. The Guildhall's striking neo-Gothic architecture is a must-see, as is the thought-provoking Museum of Free Derry. With its legendary Halloween celebrations and a thriving arts scene, Derry proves it's not just a history lesson, but a city very much alive in the present.","• Stroll along the 17th-century city walls, pausing at the iconic cannons for a bird's-eye view of the Bogside murals
• Catch a cutting-edge play at the Millennium Forum, Derry's premier performing arts venue
• Sink your teeth into a traditional Ulster Fry at Primrose on Strand Road, complete with their famous soda farl
• Cross the swooping Peace Bridge and explore the hip Ebrington Square, stopping for a craft beer at Walled City Brewery
• Delve into the city's turbulent past at the Museum of Free Derry, located in the heart of the Bogside","1. Boxty pancakes at Soda & Starch: Sink your teeth into these traditional Irish potato pancakes, served with a dollop of sour cream and chives.

2. Derry Girls afternoon tea at the Everglades Hotel: Channel your inner Erin with this quirky spread inspired by the hit sitcom, featuring cream horns and sausage rolls.

3. Slow-cooked beef and Guinness pie at Badgers Bar and Restaurant: Warm your soul with this hearty pub classic, topped with a flaky pastry crust.",,"107,000"
Diyarbakir,37.91622,40.236354,DIY,Turkey,no,no,no,no,"Diyarbakir, the vibrant heart of southeastern Turkey, is a city where ancient history collides with modern urban life in spectacular fashion. Encircled by imposing basalt walls that stretch for nearly six kilometers, this UNESCO World Heritage site boasts a mesmerizing old town filled with winding alleyways and historic mosques. Foodies will swoon over the local cuisine, with fragrant lamb kebabs and peppery çiğ köfte tempting visitors at every turn. Don't miss the striking Great Mosque, with its unique four-legged minaret, or the chance to sip strong Turkish coffee in one of the atmospheric courtyard cafes. As night falls, join locals for a stroll along the Tigris River, where the twinkling lights of the new town reflect off the water, creating a magical urban oasis.","• Explore the imposing basalt walls of Diyarbakır Fortress, a UNESCO World Heritage site, and take in panoramic views of the Tigris River from its ramparts

• Lose yourself in the narrow alleys of Hasan Paşa Hanı, a 16th-century caravanserai turned bustling bazaar, where you can haggle for local textiles and sample regional delicacies

• Marvel at the intricate stone carvings and soaring minarets of the Great Mosque (Ulu Cami), one of the oldest mosques in Anatolia, dating back to the 11th century

• Sip on a steaming cup of menengiç coffee at Cemil Pasha Mansion, a restored Ottoman-era home that now houses a fascinating ethnography museum

• Take a sunset stroll along the Ten-Eyed Bridge (On Gözlü Köprü), an ancient Roman structure spanning the Tigris, and watch as the city's lights begin to twinkle in the dusk","1. Meftune: A hearty stew of lamb, eggplant, and garlic simmered in tomato sauce – find it at Hasan Paşa Hanı for the real deal.

2. Kaburga dolması: Stuffed lamb ribs filled with aromatic rice, almonds, and currants – Demir Restaurant serves up a mouthwatering version.

3. Çiğ köfte: Raw spiced beef kneaded with bulgur and herbs – head to Çiğköfteci Ali Usta for the best in town.",,"1,000,000"
