City,Latitude,Longitude,IATA_Code,Country,Island,Capital,EU,Schengen,City_Description,City_To_Dos,Food_to_try,City_Cost,Population
Kütahya,39.41991,29.985789,KZR,Turkey,no,no,no,no,"Nestled in western Turkey, Kütahya is a hidden gem that'll have culture vultures and history buffs swooning. This charming city, famous for its exquisite ceramics and tiles, is like stepping into an open-air museum of Ottoman architecture. Wander through the winding streets of the old town, where you'll stumble upon ornate mosques and traditional Turkish houses that'll make your Instagram followers green with envy. Don't miss the Kütahya Castle for sweeping views of the city, or the Tile Museum to get your fix of the city's claim to fame. When you've worked up an appetite, dive into the local cuisine – the Kütahya tava (a meat and vegetable dish) is a must-try. With its laid-back vibe and rich cultural heritage, Kütahya is the perfect escape from Turkey's more touristy hotspots.","• Explore the intricate tile work at the Çinili Camii, a 16th-century mosque showcasing Kütahya's famed ceramics

• Dive into local history at the Kütahya Archaeology Museum, home to stunning Phrygian artifacts and a reconstructed Roman street

• Sip on traditional Turkish tea while people-watching in the bustling Ulu Cami Square, flanked by historic Ottoman-era buildings

• Get your hands dirty at a pottery workshop in the Çiniciler Çarşısı, where you can craft your own piece of Kütahya's ceramic legacy

• Take a day trip to the ancient Phrygian city of Aizanoi, marveling at its well-preserved Temple of Zeus and Roman theater","1. Çibörek: Sink your teeth into this crispy, crescent-shaped pastry stuffed with spiced minced meat – a Tatar delicacy that's become a Kütahya favourite.

2. Kütahya Tava: Sample this hearty local specialty of tender lamb chunks slow-cooked with peppers, tomatoes, and garlic in a clay pot.

3. Cimcik: Try these tiny, hand-pinched dumplings swimming in a tangy yogurt sauce – comfort food at its finest.",,"250,000"
Kutaisi,42.27161,42.705448,KUT,Georgia,no,no,no,no,"Kutaisi, Georgia's third-largest city, is a hidden gem that's rapidly emerging as a must-visit destination. This vibrant hub in the country's west seamlessly blends ancient history with a youthful, creative energy. Wander through the cobblestone streets of the Old Town, where crumbling 19th-century facades rub shoulders with hip cafes and wine bars. Don't miss the UNESCO-listed Gelati Monastery, a masterpiece of medieval architecture perched on a nearby hillside. For a taste of local life, dive into the bustling Green Bazaar, where vendors hawk everything from fresh produce to traditional Georgian cheeses. As night falls, join the trendy crowd at Palaty for craft cocktails and live music. With its laid-back vibe and rich cultural offerings, Kutaisi is the perfect antidote to Georgia's more touristy hotspots.","• Explore the awe-inspiring Bagrati Cathedral, a UNESCO World Heritage site, and soak up panoramic views of the city from its hilltop perch

• Wander through the bustling Kutaisi Market, sampling local delicacies like khachapuri and churchkhela while mingling with friendly vendors

• Take a day trip to the otherworldly Prometheus Cave, marveling at its stunning stalactites and underground river on a guided boat tour

• Catch a performance at the Kutaisi Lado Meskhishvili State Drama Theatre, a gorgeous 19th-century building showcasing Georgian theatrical talent

• Unwind with a relaxing soak at the Art Nouveau-style Tskaltubo spa resort, once a favorite of Stalin himself, just a short drive from the city center","1. Khachapuri Imeruli: Gooey, cheese-filled bread from the Imereti region, best devoured piping hot at Georgiko on Shota Rustaveli Avenue.

2. Lobio: Hearty red bean stew served in a clay pot, perfected at the rustic Toma's Wine Cellar on Griboedov Street.

3. Tkemali-glazed mtsvadi: Succulent pork skewers slathered in sour plum sauce, grilled to perfection at Sapere restaurant in the historic center.",,"147,000"
La Palma,28.65523,-17.857322,NDO,Spain,yes,no,yes,yes,"La Palma, the jewel of the Canary Islands, is a vibrant slice of paradise that's off the beaten path yet utterly unforgettable. This pint-sized stunner packs a punch with its dramatic volcanic landscapes, lush laurel forests, and pristine black sand beaches. The island's capital, Santa Cruz de La Palma, is a charming blend of colonial architecture and laid-back island vibes, where colorful balconies overlook cobblestone streets. By day, hike the otherworldly terrain of Caldera de Taburiente National Park, and by night, gaze at one of the world's clearest night skies at the Roque de los Muchachos Observatory. Foodies will swoon over the fresh seafood and local wines, while adventure seekers can get their fix with world-class stargazing, diving, and hiking. La Palma is the ultimate escape for those seeking natural beauty and tranquility with a dash of Spanish flair.","• Sip on a glass of Malvasía wine while watching the sunset at Mirador El Time, offering breathtaking views of the Aridane Valley

• Explore the otherworldly landscapes of Caldera de Taburiente National Park, hiking through ancient pine forests and cooling off in crystal-clear waterfalls

• Embark on a stargazing adventure at the Roque de los Muchachos Observatory, home to one of the world's largest telescopes

• Indulge in fresh seafood at Casa Osmunda in Tazacorte, savoring their signature grilled octopus while overlooking the black sand beach

• Wander through the colorful streets of Santa Cruz de La Palma, popping into quirky shops and admiring the traditional Canarian balconies on Calle Real","1. Salty, crispy papas arrugadas con mojo picón at Bodegón Tamanca - these wrinkly potatoes with spicy sauce are a Canarian classic

2. Fresh grilled vieja (parrotfish) drizzled with local olive oil at El Duende del Fuego

3. Creamy queso palmero (local goat's cheese) with honey and almonds at Casa Goyo

4. Hearty potaje de berros (watercress stew) at Restaurante El Jardín de la Sal

5. Rich, velvety bienmesabe for dessert at La Placeta",,"85,000"
La Rochelle,46.15911,-1.152043,LRH,France,no,no,yes,yes,"Nestled on France's Atlantic coast, La Rochelle is a maritime marvel that effortlessly blends historic charm with a laid-back seaside vibe. This picturesque port city boasts an impressive medieval harbor, guarded by three iconic towers that have become the town's calling card. Wander through the arcaded streets of the old town, where chic boutiques and bustling cafés spill onto sun-dappled cobblestones. Foodies will swoon over the fresh seafood on offer, while culture vultures can get their fix at the cutting-edge Aquarium or the fascinating Maritime Museum. As day turns to night, join the locals for an aperitif along the buzzing Vieux Port, where sleek yachts bob in the twilight. With its eco-friendly ethos and abundance of bike lanes, La Rochelle is a breath of fresh air that'll leave you feeling positively buoyant.","• Climb the 15th-century Tour de la Lanterne for sweeping views of the Old Port and beyond

• Dive into marine life at the cutting-edge Aquarium La Rochelle, home to 12,000 sea creatures

• Sip local Cognac and feast on fresh seafood at the bustling Marché Central

• Catch some rays and people-watch at the chic Plage de la Concurrence

• Hop on a boat to explore the nearby Île de Ré, with its whitewashed villages and salt marshes","1. Éclade de moules: Smoky pine needle-roasted mussels at La Yole de Chris

2. Galette charentaise: Buttery biscuit with cognac at Pâtisserie Bégaud

3. Plateau de fruits de mer: Towering seafood platter at André

4. Mouclade: Creamy curry-spiked mussels at Le Café de la Paix

5. Cognac-infused oysters at Le Bar André",,"75,000"
Lakselv,70.05250,24.960657,LKL,Norway,no,no,no,yes,"Lakselv, a quaint northern gem nestled in Norway's Finnmark county, is the perfect escape for those seeking Arctic adventures with a dash of small-town charm. This compact community of just over 2,000 residents punches well above its weight in natural beauty, offering visitors a front-row seat to the mesmerizing Northern Lights and the eerie phenomenon of the Midnight Sun. Outdoor enthusiasts will find themselves spoiled for choice, with world-class salmon fishing in the Lakselv River and hiking trails that wind through pristine wilderness. Don't miss the opportunity to immerse yourself in Sami culture at the nearby Sami Center, where traditional crafts and reindeer herding practices come to life. For a true taste of the Arctic, Lakselv serves up an unexpected culinary scene, with local eateries dishing out fresh seafood and regional specialties that will warm you from the inside out.","• Paddle a kayak through the pristine waters of Porsangerfjorden, keeping an eye out for seals and sea eagles
• Try your hand at Arctic fishing on the Lakselva river, known for its impressive salmon runs
• Explore the rugged tundra landscapes of Stabbursdalen National Park on a guided hike
• Indulge in locally-sourced reindeer dishes at the cozy Porsanger Vertshus restaurant
• Witness the mesmerizing Northern Lights dance across the sky during the polar night season (late November to mid-January)","1. Reindeer steak with lingonberry sauce at Lakselv Hotel's restaurant
2. Freshly caught Arctic char from the Lakselv River, grilled at Skoganvarre Camping
3. Homemade cloudberry jam on warm lefse at Café Lakselv",,"1,162"
Lamezia Terme,38.96451,16.302145,SUF,Italy,no,no,yes,yes,"Nestled in the heart of Calabria, Lamezia Terme is a hidden gem that's begging to be explored. This vibrant city, formed by the merger of three historic towns, offers a delightful blend of ancient charm and modern convenience. With its thermal baths dating back to Roman times, Lamezia is a paradise for wellness seekers. But don't be fooled – this isn't just a spa town. The city boasts a thriving food scene, with local specialties like 'nduja and pecorino cheese that'll make your taste buds dance. History buffs will love wandering through the medieval Nicastro district, while nature lovers can escape to the nearby Sila National Park. And with its international airport, Lamezia Terme is the perfect gateway to discover the rugged beauty of southern Italy. Trust us, this underrated Calabrian hotspot is worth adding to your travel bucket list.","• Sip on locally-produced Calabrian wines at Cantine Statti, a historic vineyard just outside the city center
• Explore the ruins of the 9th-century Castello Normanno-Svevo, offering panoramic views of the Tyrrhenian Sea
• Take a dip in the therapeutic sulphur springs at Terme di Caronte, a natural spa known for its healing properties
• Indulge in authentic Calabrian cuisine at Ristorante A Lanterna, famous for its 'nduja-stuffed arancini
• Wander through the charming old town of Nicastro, stopping to admire the intricate frescoes in the 12th-century Diocesan Museum","1. 'Nduja-stuffed arancini at Trattoria da Cenzo - these crispy rice balls pack a spicy Calabrian punch

2. Fileja pasta with 'nduja and ricotta at Osteria dell'Anfora - hand-rolled pasta meets fiery spreadable salami

3. Pitta 'mpigliata at Pasticceria Torcasio - a festive sweet bread swirled with nuts, raisins and cinnamon",,"70,000"
Lampedusa,35.51113,12.596291,LMP,Italy,yes,no,yes,yes,"Lampedusa, the sun-soaked jewel of the Mediterranean, is a tiny Italian island that packs a big punch. This remote outpost, closer to Tunisia than Sicily, is a paradise for beach bums and nature lovers alike. With its crystal-clear turquoise waters and pristine white sand beaches, Lampedusa is the ultimate escape from the hustle and bustle of mainland life. The island's main town, also called Lampedusa, is a charming jumble of narrow streets and whitewashed buildings, where you can sample fresh seafood at family-run trattorias or sip an Aperol Spritz while watching fishing boats bob in the harbor. Don't miss the otherworldly Rabbit Beach, consistently ranked among the world's best, or the chance to spot loggerhead turtles nesting along the shore. With its laid-back vibe and stunning natural beauty, Lampedusa is the perfect spot to unwind and soak up the authentic Mediterranean charm.","• Soak up the sun at Spiaggia dei Conigli, voted one of the world's best beaches, and spot loggerhead turtles nesting in the soft sand

• Dive into the crystal-clear waters of Cala Pulcino, a hidden cove accessible only by boat or a scenic 45-minute hike

• Feast on freshly caught seafood at Da Nicola, a no-frills trattoria serving up the island's best pasta con le sarde

• Explore the haunting ruins of the 16th-century Torre di Cavallo, offering panoramic views of the Mediterranean at sunset

• Join a local fisherman for a day trip to spot dolphins and learn traditional fishing techniques in the Pelagie Islands Marine Protected Area","1. Freshly caught cernia (grouper) grilled to perfection at La Lampara, drizzled with local olive oil and lemon

2. Couscous alla Lampedusana at Trattoria del Porto, loaded with seafood and a rich tomato sauce

3. Cassatelle, sweet ricotta-filled pastries, from Pasticceria dell'Isola

4. Pasta con le sarde (pasta with sardines) at Il Cappero, featuring wild fennel and pine nuts

5. Granita di gelsi (mulberry granita) from Bar Dell'Amicizia, the perfect refresher on a hot day",,"6,000"
Lanzarote,29.03971,-13.636292,ACE,Spain,yes,no,yes,yes,"Lanzarote, the easternmost gem of Spain's Canary Islands, is a surreal moonscape that'll have you questioning whether you've landed on Earth or Mars. This volcanic wonderland boasts otherworldly black sand beaches, epic wave-battered cliffs, and an embarrassment of modernist architecture courtesy of local legend César Manrique. Foodies will swoon over the fresh seafood and volcanic-soil-nurtured wines, while adventure junkies can get their fix kitesurfing in Famara or exploring the lava tunnels of Cueva de los Verdes. Don't miss the mind-bending Timanfaya National Park, where geothermal demonstrations will literally fire up your visit. With year-round sunshine and a laid-back vibe, Lanzarote is the ultimate escape for those seeking a perfect blend of nature, culture, and chill.","• Catch a mind-bending art show at the César Manrique Foundation, where the island's most famous artist merged nature and creativity in his volcanic bubble home

• Sip on volcanic-soil-grown wines at the rustic El Grifo bodega, Lanzarote's oldest winery, before touring its quirky wine museum

• Dive into the crystal-clear waters of Playa Chica in Puerto del Carmen, a hidden cove perfect for snorkeling among vibrant marine life

• Take a surreal journey through Timanfaya National Park's 'Mountains of Fire' on a camel, traversing lunar-like landscapes formed by 18th-century eruptions

• Feast on fresh seafood at El Golfo's waterfront restaurants, watching the sun set over the mesmerizing green lagoon of Charco de los Clicos","1. Papas arrugadas con mojo picón at El Diablo restaurant in Timanfaya National Park - these wrinkly potatoes with spicy sauce are even more epic when cooked using volcanic heat.

2. Fresh-caught vieja (parrotfish) grilled to perfection at La Tegala in Mácher - trust us, it's worth the splurge for this local delicacy.

3. Gofio escaldado at Tasca La Raspa in Arrecife - dive into this hearty Canarian staple made from toasted grain flour and fish broth.",,"150,000"
Larnaca,34.92361,33.623618,LCA,Cyprus,yes,no,yes,no,"Larnaca is Cyprus' laid-back coastal gem, where sun-soaked beaches meet a vibrant cultural scene. This charming city boasts a palm-lined promenade that's perfect for leisurely strolls and people-watching at trendy cafés. History buffs will love exploring the 9th-century Church of Saint Lazarus, while foodies can dive into meze feasts at traditional tavernas. Don't miss the flamingo-filled Salt Lake or the bustling Finikoudes Beach. With its mix of ancient sites, modern amenities, and a refreshingly chill vibe, Larnaca offers the quintessential Mediterranean experience without the tourist crush of larger resorts. It's the ideal spot to sip a frappe, soak up some rays, and embrace the easy-going Cypriot lifestyle.","• Soak up the sun at Finikoudes Beach, then stroll along its palm-lined promenade for a sundowner at Hobos Steak House
• Explore the intricate frescoes and Byzantine artifacts at the 9th-century Church of Saint Lazarus
• Dive into history at the ancient ruins of Kition, where you can walk among Mycenaean colonists' remains from 13th century BC
• Feast on meze and fresh seafood at Militzis Restaurant, a local favorite tucked away in the old Turkish quarter
• Take a sunset cruise around Larnaca Bay, spotting flamingos at the salt lake before the sky erupts in a riot of color","1. Koupepia at To Kazani: Succulent grape leaves stuffed with minced pork, rice, and herbs, slow-cooked to perfection in this cozy taverna.

2. Seafood meze at Militzis: A parade of small plates featuring the catch of the day, from grilled octopus to crispy whitebait, served metres from the Mediterranean.

3. Souvlaki at Lazaris Kebab House: Juicy chunks of pork or chicken, char-grilled and wrapped in pillowy pita with tzatziki and hand-cut chips.

4. Loukoumades at To Hani: Crispy, honey-soaked dough balls sprinkled with cinnamon – the ultimate sweet treat after a day at the beach.

5. Kleftiko at To Steki tou Savva: Fall-off-the-bone lamb slow-cooked with potatoes and herbs in a clay oven, best enjoyed with a carafe of local wine.",,"85,000"
Las Palmas,28.12887,-15.434902,LPA,Spain,yes,no,yes,yes,"Welcome to Las Palmas, the vibrant capital of Gran Canaria that's equal parts sun-soaked beach paradise and buzzing urban hotspot. This cosmopolitan city effortlessly blends its rich colonial history with a thoroughly modern vibe, evident in its stunning architecture and eclectic food scene. Wander through the charming cobblestone streets of Vegueta, the historic old town, before hitting the golden sands of Las Canteras, one of the world's best city beaches. Foodies will be in heaven at the Mercado de Vegueta, while culture vultures can get their fix at the striking Alfredo Kraus Auditorium. With its year-round balmy climate and infectious Canarian energy, Las Palmas is the ultimate destination for those seeking a perfect mix of relaxation and excitement.","• Soak up the sun and surf at Las Canteras Beach, then hit the promenade for a sundowner at La Azotea de Benito
• Wander through the colorful streets of Vegueta, stopping to admire the Gothic architecture of Santa Ana Cathedral
• Indulge in a tapas crawl along Calle Mendizábal, making sure to try the local papas arrugadas at Tasca Galileo
• Get your culture fix at the Centro Atlántico de Arte Moderno (CAAM), followed by a craft cocktail at The Gin Room
• Take a day trip to the Bandama Caldera, hiking the rim for breathtaking views, then reward yourself with wine tasting at Bodega Los Lirios","1. Papas arrugadas con mojo: These wrinkly Canarian potatoes served with spicy red and green mojo sauces are a must-try at El Herreño, a no-frills local joint in Vegueta.

2. Sancocho canario: Dive into this hearty fish stew with sweet potatoes and gofio at La Marinera, where the ocean views are as good as the grub.

3. Ropa vieja: Head to Casa Montesdeoca for their melt-in-your-mouth version of this shredded beef and chickpea dish, served in a cozy 17th-century mansion.",,"380,000"
Leeds,53.79742,-1.543794,LBA,United Kingdom,no,no,no,no,"Leeds: A Northern Powerhouse with Grit and Glamour

This West Yorkshire gem is a city that refuses to be pigeonholed. Once an industrial workhorse, Leeds has reinvented itself as a vibrant cultural hub without losing its down-to-earth charm. The compact city centre is a shopper's paradise, from the elegant Victorian arcades to the glitzy Trinity Leeds mall. By night, the Call Lane area buzzes with hipster bars and live music venues, while the regenerated waterfront at Granary Wharf offers swanky cocktail spots with killer views. Culture vultures can get their fix at the world-class Leeds Playhouse or the innovative Leeds Art Gallery. And let's not forget the legendary Leeds United, whose Elland Road stadium is a mecca for football fans. With a booming food scene, top-notch universities, and more green space than you'd expect, Leeds is the North's worst-kept secret – and we wouldn't have it any other way.","• Sip on craft cocktails and soak up panoramic views at Issho's stunning rooftop terrace, nestled atop Victoria Gate
• Catch a cutting-edge indie gig at the iconic Brudenell Social Club, a beloved grassroots music venue in Hyde Park
• Embark on a street art tour through the Northern Quarter, spotting vibrant murals by local artists like Nomad Clan
• Indulge in a decadent afternoon tea at Crafthouse, featuring skyline vistas and inventive Yorkshire-inspired treats
• Explore the atmospheric ruins of Kirkstall Abbey, a 12th-century Cistercian monastery set along the River Aire","1. The legendary Yorkshire pudding wrap from York Roast Co. on Kirkgate – a Sunday roast rolled up in a giant yorkie.

2. Crispy chilli beef with egg-fried rice at Mans Market, a trendy Chinese joint in Wellington Place.

3. The 'Full Yorkshire' breakfast at Laynes Espresso, featuring locally sourced sausages and black pudding from Sykes House Farm.

4. A proper pint of Leeds Brewery's Yorkshire Gold ale at Whitelock's, the city's oldest pub.

5. The 'Dirty Burger' at Patty Smith's in Belgrave Music Hall – a juicy beef patty topped with bacon jam and blue cheese.",,"793,139"
Leipzig,51.34063,12.374733,LEJ,Germany,no,no,yes,yes,"Leipzig: Where cool meets classical in Germany's hippest hidden gem. This Saxon city pulsates with creative energy, blending centuries-old charm with a thriving alternative scene. Wander through the historic Altstadt, where Bach once composed, then dive into the buzzing Plagwitz district, where abandoned factories have been transformed into cutting-edge galleries and indie music venues. Foodies will drool over the gourmet delights at the 12th-century Markthalle, while culture vultures can get their fix at world-class museums like the Museum of Fine Arts. As night falls, join the locals for a crisp Gose beer in one of the city's atmospheric Kneipen (pubs) before catching an avant-garde performance at the iconic Gewandhaus. With its infectious spirit and off-the-beaten-path appeal, Leipzig is the German city break you didn't know you needed.","• Dive into Leipzig's musical heritage at the Bach Museum, then catch a soul-stirring performance by the St. Thomas Boys Choir at Thomaskirche
• Sip on a frothy Gose beer at Bayerischer Bahnhof, the world's oldest railway tavern, before exploring the trendy Plagwitz district's street art scene
• Channel your inner book nerd at the awe-inspiring Bibliotheca Albertina, then hunt for literary treasures in the charming shops of the Barfußgäßchen
• Get your art fix at the cutting-edge Leipzig Museum of Contemporary Art, followed by a sunset picnic in the sprawling Clara-Zetkin-Park
• Time-travel through East German history at the immersive Zeitgeschichtliches Forum, then dance the night away at Distillery, the city's oldest techno club","1. Leipziger Lerche: A marzipan-filled shortcrust pastry with a gooey jam centre, named after the city's once-popular lark dish.

2. Quarkkeulchen: Crispy-on-the-outside, fluffy-on-the-inside potato pancakes made with quark cheese, served with applesauce.

3. Leipziger Allerlei: A colourful veggie medley featuring asparagus, carrots, and peas, often jazzed up with crayfish and morels.",,"600,000"
