City,Latitude,Longitude,IATA_Code,Country,Island,Capital,EU,Schengen,City_Description,City_To_Dos,Food_to_try,City_Cost,Population
Reykjavík,64.14598,-21.942237,RKV,Iceland,yes,yes,no,yes,"Reykjavík, Iceland's quirky capital, is a Nordic playground that punches well above its weight. This pint-sized metropolis serves up a heady cocktail of cutting-edge design, world-class cuisine, and geothermal-powered nightlife. By day, wander through colorful corrugated-iron houses and gaze at the futuristic Hallgrímskirkja church piercing the sky. Come nightfall, dive into the city's legendary bar scene, where locals party like Vikings until the wee hours. Don't miss a dip in one of the many thermal pools - it's where the real action happens. With its backdrop of snow-capped mountains and the ethereal Northern Lights, Reykjavík is the ultimate urban-meets-wilderness adventure.","• Soak in the ethereal waters of the Blue Lagoon, just a 40-minute drive from the city centre, for the ultimate Icelandic spa experience

• Catch a gig at the iconic Harpa Concert Hall, marvelling at its striking glass honeycomb exterior before losing yourself in world-class performances

• Climb to the top of Hallgrímskirkja church for jaw-dropping 360° views of Reykjavík's colourful rooftops and the snow-capped mountains beyond

• Embark on a whale-watching tour from the Old Harbour, keeping your eyes peeled for minke whales, humpbacks, and playful dolphins in the chilly Atlantic waters

• Dive into Reykjavík's culinary scene at Grandi Mathöll food hall, sampling everything from traditional Icelandic hot dogs to cutting-edge Nordic fusion dishes","1. Plokkfiskur at Þrír Frakkar - this hearty fish stew is comfort food at its finest, served with dark rye bread

2. Langoustine soup at Sægreifinn - a creamy, flavourful bowl topped with plump Icelandic lobster tails

3. Lamb hot dog from Bæjarins Beztu Pylsur - the city's famous street food, loaded with crispy onions and remoulade

4. Fermented shark (hákarl) at Café Loki - not for the faint-hearted, but a true Icelandic delicacy

5. Skyr crème brûlée at Grillmarket - a modern twist on the traditional Icelandic yogurt, with a satisfying crackle",,"131,000"
Rhodes,36.17263,27.919418,RHO,Greece,yes,no,yes,yes,"Rhodes, the sun-soaked jewel of the Dodecanese, is a city that effortlessly blends ancient history with modern Mediterranean charm. Wander through the UNESCO-listed Old Town, where cobblestone streets wind between imposing medieval walls and Byzantine churches. Don't miss the Palace of the Grand Master, a 14th-century fortress that looms large over the cityscape. For a taste of local life, hit up Nea Agora, where the aroma of freshly baked spanakopita mingles with the salty sea air. As night falls, join the locals for an ouzo-fueled evening in Hippocrates Square, where tavernas spill out onto the streets and the sound of bouzouki music fills the air. With its perfect mix of culture, cuisine, and coastline, Rhodes is the ultimate Greek island getaway.","• Sip on a sunset cocktail at Elli Beach Bar, where the Aegean meets ancient history
• Wander through the medieval Street of the Knights, stopping to marvel at the Grand Master's Palace
• Dive into crystal-clear waters at Anthony Quinn Bay, named after the Hollywood star
• Feast on fresh seafood at Nireas, a hidden gem tucked away in the Old Town's narrow alleys
• Get your culture fix at the Archaeological Museum, home to the famous Aphrodite of Rhodes statue","1. Pitaroudia: Crispy chickpea fritters with a hint of mint, served piping hot at To Marouli taverna in the Old Town

2. Karavolous giahni: Tender snails slow-cooked in tomato sauce with cumin and rosemary, best savored at Alexis 4 Seasons in Lindos

3. Talagoutes: Delicate pancakes drizzled with local thyme honey and crushed walnuts, a must-try at Tamam in Rhodes Town

4. Souvlaki me louvana: Grilled pork skewers wrapped in flatbread with tangy yellow split peas, found at the bustling Meltemi street food joint

5. Athoi yemistoi: Zucchini flowers stuffed with rice and herbs, a seasonal specialty at the family-run Mama Sofia's in Archangelos",,"115,000"
Riga,56.94940,24.105185,DGA,Latvia,no,yes,yes,yes,"Riga, Latvia's captivating capital, is a Baltic gem that seamlessly blends medieval charm with cutting-edge cool. Wander through the UNESCO-listed Old Town, where cobblestone streets lead to architectural marvels spanning Gothic, Baroque, and Art Nouveau styles. Foodies will swoon over the bustling Central Market, housed in repurposed Zeppelin hangars, while culture vultures can get their fix at the Latvian National Opera or the striking National Library. As night falls, hipster hangouts in the creative Miera iela district come alive, offering craft cocktails and live music. With its vibrant arts scene, world-class museums, and gorgeous Jugendstil buildings, Riga is the perfect blend of old-world romance and modern Baltic flair.","• Sip on Black Balsam, Riga's legendary herbal liqueur, at the eccentric Folkklubs Ala Pagrabs – a subterranean tavern where live folk music and hearty Latvian fare reign supreme

• Channel your inner art nouveau enthusiast with a stroll down Alberta iela, gawking at the whimsical facades of Mikhail Eisenstein's architectural masterpieces

• Brave the vertigo-inducing views from St. Peter's Church tower, then reward yourself with a craft beer at the nearby Labietis microbrewery

• Dive into Soviet-era nostalgia at the quirky Zuzeum Art Centre, housed in a former candy factory, where contemporary art meets industrial chic

• Escape the tourist throngs with a paddleboard adventure along the Daugava River, ending with a sunset picnic at Lucavsala island's urban beach","1. Smoked eel with horseradish cream at Dome Fish Restaurant
2. Black bread ice cream at Kolonade
3. Riga Black Balsam-infused pork ribs at 3 Pavāru Restorāns",,"632,614"
Rize,41.02482,40.519914,BZZ,Turkey,no,no,no,no,"Nestled along Turkey's enchanting Black Sea coast, Rize is a hidden gem that's bursting with vibrant culture and lush natural beauty. This compact city packs a punch with its emerald-green tea plantations cascading down misty hillsides, creating a mesmerizing backdrop that's straight out of a postcard. Foodies will swoon over the region's famous black tea and pide (Turkish pizza), while adventure seekers can get their fix hiking through the nearby Kaçkar Mountains. Don't miss the chance to explore the city's charming old quarter, where Ottoman-era houses rub shoulders with bustling tea houses and local artisans ply their trade. With its laid-back vibe and stunning scenery, Rize offers a refreshing escape from Turkey's more touristy haunts – just don't forget to bring your umbrella, as this subtropical paradise is known for its frequent rainfall!","• Sip on aromatic black tea at the historic Ziraat Çay Bahçesi, watching fishermen cast their nets in the Black Sea
• Dive into Rize's past at the ethnographic Rize Museum, housed in a beautifully restored 19th-century mansion
• Trek through misty tea plantations to the thundering Palovit Waterfall in Çamlıhemşin, a hidden gem of the Kaçkar Mountains
• Feast on pide topped with melted Koloti cheese and a side of mıhlama at the bustling Liman Restaurant
• Zip across the Fırtına Valley on a heart-pumping zipline adventure at the Ziplinerize Macera Parkı","1. Muhlama: Gooey, stretchy corn-flour fondue with melted cheese and butter. A local favorite at riverside restaurants.

2. Rize Kavurması: Tender cubes of beef sautéed with peppers and tomatoes. Best enjoyed at Zeki'nin Yeri with a view of the Black Sea.

3. Laz Böreği: Flaky pastry layered with custard and doused in syrup. Grab a slice at Çaykur Çay Evi for the perfect afternoon treat.",,"100,000"
Rome,41.89332,12.482932,ROM,Italy,no,yes,yes,yes,"Rome, the Eternal City, is a living museum where ancient history collides with modern flair. Cobblestone streets wind through a maze of architectural marvels, from the imposing Colosseum to the baroque splendor of the Trevi Fountain. Foodies rejoice in the city's culinary scene, where traditional trattorias serve up perfect pasta alongside trendy bistros. Art aficionados can lose themselves in the Vatican Museums, while fashionistas strut down Via del Corso. As the sun sets, Romans and visitors alike flock to the lively Campo de' Fiori for aperitivo, proving that in Rome, la dolce vita is not just a saying—it's a way of life.","• Sip a negroni at the ultra-chic Stravinskij Bar in Hotel de Russie, then people-watch in the elegant Piazza del Popolo
• Get your gelato fix at Fatamorgana in Monti, where flavors like black rice and rose petal push the boundaries of frozen treats
• Channel your inner gladiator with a after-hours tour of the Colosseum's underground chambers and arena floor
• Escape the tourist crowds and discover contemporary Roman art at MACRO, housed in a converted Peroni beer factory
• Indulge in a plate of cacio e pepe at Roscioli, a deli-cum-restaurant that's a favorite among locals and visiting foodies alike","1. Cacio e pepe at Felice a Testaccio – this creamy, peppery pasta perfection is Rome on a plate

2. Supplì al telefono from I Supplì – crispy, phone cord-stretching mozzarella goodness in rice ball form

3. Maritozzo con panna at Il Maritozzaro – a sweet, cream-filled bun that's the breakfast of Roman champions

4. Pizza al taglio from Antico Forno Roscioli – by-the-slice heaven with toppings that change daily

5. Carbonara at Roscioli Salumeria con Cucina – the ultimate Roman comfort food done right",,"2,770,822"
Rotterdam,51.92444,4.477750,RTM,Netherlands,no,no,yes,yes,"Rotterdam: The Netherlands' audacious second city is a thrilling blend of old-world charm and cutting-edge architecture. This bustling port town has reinvented itself as a hotbed of innovation, with jaw-dropping skyscrapers like the tilted Cube Houses and the pencil-thin Erasmus Bridge piercing the skyline. Foodies flock to the cavernous Markthal, a horseshoe-shaped food hall housed beneath an epic fruit-and-veg-themed ceiling mural. By night, the city pulses with energy, from the trendy bars of Witte de Withstraat to the eclectic music scene at BIRD. Rotterdam's got swagger in spades, and it's not afraid to show it.","• Soar up the Euromast for jaw-dropping 360° views of the city, then brave the heart-pumping zipline descent
• Dive into the surreal world of Boijmans Van Beuningen's Depot, the world's first publicly accessible art storage facility
• Hop on a water taxi and zip across to Katendrecht for mouthwatering street food at the Fenix Food Factory
• Get your architecture fix with a stroll through the mind-bending Cube Houses, then grab a coffee at the tilted Kijk-Kubus Museum-House
• Catch a gig at BIRD, a hip jazz club in an old grain silo, before bar-hopping along the buzzing Witte de Withstraat","1. Kapsalon from Jaffa Shoarma: A gut-busting combo of fries, shawarma, melted Gouda, and garlic sauce that's pure Rotterdam indulgence.

2. Herrings from Schmidt Zeevis: Slippery, briny, and oh-so-Dutch. Grab them by the tail and slide 'em down your throat like a local.

3. Surinamese roti from Roopram Roti: Flaky flatbread wrapped around curry chicken, potatoes, and egg. It's a flavor bomb that'll knock your socks off.",,"651,446"
Rovaniemi,66.49762,25.719210,RVN,Finland,no,no,yes,yes,"Rovaniemi, the official hometown of Santa Claus, is a winter wonderland that'll make even the Grinchiest traveler's heart grow three sizes. This quirky Finnish city, perched on the Arctic Circle, is where Christmas dreams come true year-round. Imagine reindeer-pulled sleigh rides through snowy forests, cozy log cabins with steaming saunas, and the chance to meet the big man in red himself at Santa Claus Village. But Rovaniemi isn't just about yuletide cheer – it's also a prime spot for catching the mesmerizing Northern Lights, dog sledding adventures, and indulging in hearty Lappish cuisine. With its blend of modern Scandinavian design and rustic charm, Rovaniemi is the perfect base for Arctic exploration or simply embracing your inner child in a real-life snow globe.","• Embark on a magical journey at Santa Claus Village, where you can cross the Arctic Circle, meet the jolly man himself, and send postcards from Santa's Post Office
• Get your adrenaline pumping with a husky sledding adventure through Lapland's pristine wilderness, followed by a cozy cup of Finnish berry juice by the campfire
• Immerse yourself in Lappish culture at Arktikum, a striking glass-roofed museum where you can explore everything from Northern Lights science to indigenous Sámi heritage
• Indulge in a traditional Finnish smoke sauna experience at Kesärannan Sauna, topped off with an invigorating dip in the icy Kemijoki River
• Feast on locally-sourced Arctic delicacies like reindeer tartare and cloudberry parfait at the stylish Nili Restaurant, a stone's throw from the city center","1. Reindeer fillet with lingonberry sauce at Nili Restaurant
2. Smoked Arctic char with dill potatoes at Ravintola Roka
3. Cloudberry crème brûlée at Sky Kitchen & View",,"63,000"
Rzeszów,50.03745,22.004717,RZE,Poland,no,no,yes,yes,"Nestled in southeastern Poland, Rzeszów is a hidden gem that's quickly becoming the cool kid on the Eastern European block. This compact city packs a punch with its blend of rich history and cutting-edge modernity. Wander through the charming Old Town, where the Renaissance-era Town Hall holds court, before diving into the city's underground tunnels for a quirky history lesson. Rzeszów's youthful vibe, courtesy of its large student population, is evident in the buzzing café scene and trendy bars along 3 Maja Street. Tech nerds will geek out over ""Aviation Valley,"" the city's aerospace hub, while culture vultures can get their fix at the sleek Podkarpackie Voivodeship Cultural Centre. With its manageable size and effortless charm, Rzeszów is the perfect off-the-beaten-path destination for travelers looking to experience Poland beyond the usual suspects.","• Explore the stunning underground tourist route beneath the Old Town Square, marveling at centuries-old cellars and hidden passageways

• Catch a cutting-edge performance at the Maska Theatre, Rzeszów's edgy venue for avant-garde drama and experimental shows

• Sip on craft cocktails at Whiskey in the Jar, a hip speakeasy-style bar with live jazz and an impressive selection of spirits

• Wander through the whimsical Multimedia Fountain Park after dark, where water, light, and music combine for a mesmerizing sensory experience

• Indulge in traditional Podkarpackie cuisine at Stary Browar Rzeszowski, housed in a 16th-century brewery with exposed brick walls and copper brewing vats","1. Proziaki: These traditional flatbreads made with baking soda are a local specialty. Grab them fresh from Piekarnia Olszynka and slather with butter for a simple, satisfying snack.

2. Pierogi ruskie at Stary Browar Rzeszowski: These potato and cheese-filled dumplings are a Polish staple, but the ones here are particularly good. Crispy on the outside, creamy on the inside – perfection.

3. Kaszanka (blood sausage) at Restauracja Stare Miasto: Don't knock it till you've tried it. This hearty sausage is surprisingly delicious, especially when paired with caramelized onions and a cold local beer.",,"196,078"
Saint Petersburg,59.93873,30.316229,LED,Russia,no,no,no,no,"Saint Petersburg, Russia's imperial jewel, is a city that oozes grandeur and cultural clout from every ornate facade and gilded dome. This enchanting metropolis, sprawled across 42 islands and laced with romantic canals, is a feast for the senses. By day, marvel at the Hermitage's world-class art collection, housed in the jaw-dropping Winter Palace. As night falls, catch a soul-stirring performance at the Mariinsky Theatre, where tutus and tiaras reign supreme. In summer, revel in the surreal White Nights, when the sun barely sets and the city pulses with endless energy. From the technicolor onion domes of the Church of the Savior on Spilled Blood to the trendy bars of Rubinstein Street, Saint Petersburg serves up a intoxicating cocktail of history and hipster cool that'll leave you dizzy with delight.","• Marvel at the intricate mosaics and gilded domes of the Church of the Savior on Spilled Blood, a kaleidoscopic feast for the eyes
• Catch a world-class performance of Swan Lake at the legendary Mariinsky Theatre, where Tchaikovsky's masterpiece first graced the stage
• Lose yourself in the vast collections of the Hermitage Museum, stopping to gawk at Rembrandt's Return of the Prodigal Son
• Cruise along the Neva River at midnight during White Nights, watching the city's drawbridges rise in a mechanical ballet
• Indulge in caviar and vodka at the opulent L'Europe restaurant, channeling your inner Romanov amid Art Nouveau splendor","1. Pyshki at Pyshechnaya on Bolshaya Konyushennaya: These deep-fried doughnut-like treats are a Saint Petersburg institution, best enjoyed with a strong cup of coffee.

2. Beef Stroganoff at L'Europe in the Grand Hotel Europe: Sample this quintessential Russian dish in its most opulent setting, where it's been perfected over a century.

3. Caviar and blini at Caviar Bar & Restaurant: Indulge in various types of caviar served with traditional Russian pancakes and a shot of ice-cold vodka for the full experience.",,"5,398,064"
Salerno,40.68036,14.759454,QSR,Italy,no,no,yes,yes,"Salerno, the sun-kissed gem of Italy's Amalfi Coast, is a city that effortlessly blends ancient charm with modern vibrancy. This often-overlooked coastal haven boasts a stunning seafront promenade that rivals any in Europe, perfect for a leisurely stroll or an Aperol spritz at sunset. History buffs will swoon over the city's medieval core, where the impressive Duomo di Salerno stands as a testament to Norman architecture. Foodies, prepare your taste buds for a treat – Salerno's culinary scene is a delicious mix of traditional Campanian fare and innovative twists on Italian classics. With its laid-back vibe and proximity to postcard-perfect towns like Positano and Ravello, Salerno offers all the allure of the Amalfi Coast without the tourist crowds. Trust us, this underrated city is the perfect base for your next Italian adventure.","• Soak up the sun and sea breeze at Lungomare Trieste, Salerno's picturesque promenade, before tucking into fresh seafood at one of the charming waterfront eateries

• Step back in time at the 11th-century Duomo di Salerno, marveling at its stunning Romanesque crypt and the tomb of St. Matthew

• Get your culture fix at the Museo Diocesano, where you can gawk at medieval ivories and the exquisite 12th-century Salerno Ivories

• Lose yourself in the narrow, winding streets of the Centro Storico, popping into artisanal shops and pausing for an espresso at a hidden piazza

• Take a day trip to nearby Vietri sul Mare, the gateway to the Amalfi Coast, to browse its famous hand-painted ceramics and soak up jaw-dropping coastal views","1. Scazzetta di Salerno: This delightful local pastry, shaped like a cardinal's hat, is filled with cream and topped with wild strawberries.

2. Colatura di alici di Cetara: A pungent fish sauce made from fermented anchovies, drizzled over spaghetti with garlic and parsley.

3. Ndunderi: Gnocchi-like dumplings made with ricotta cheese, served in a rich tomato sauce with a generous dusting of Parmigiano-Reggiano.",,"131,905"
Salzburg,47.79813,13.046481,SZG,Austria,no,no,yes,yes,"Nestled in the heart of Austria, Salzburg is a picturesque gem that effortlessly blends old-world charm with a vibrant cultural scene. This compact city packs a serious punch, boasting baroque architecture that'll make your Instagram followers swoon and a musical legacy that'll have you humming Mozart tunes for days. Wander through the UNESCO-listed Old Town, where narrow cobblestone streets lead to hidden courtyards and charming cafes serving up Sachertorte to die for. Don't miss the imposing Hohensalzburg Fortress looming above, offering killer views of the surrounding Alps. Whether you're a culture vulture hitting up the Salzburg Festival or a Sound of Music fanatic twirling through the Mirabell Gardens, this city serves up a slice of Austrian magic that's impossible to resist.","• Explore the labyrinthine passageways of Hohensalzburg Fortress, Europe's largest intact castle, for panoramic views and a dose of medieval intrigue

• Indulge in a slice of the original Sachertorte at Café Tomaselli, the oldest coffee house in Austria, where Mozart himself once sipped his morning brew

• Channel your inner von Trapp at the Mirabell Gardens, twirling through the iconic ""Do-Re-Mi"" fountain featured in ""The Sound of Music""

• Dive into the avant-garde at Museum der Moderne Mönchsberg, perched atop the Mönchsberg with its killer views and cutting-edge exhibitions

• Sip on locally-brewed Stiegl beer at the Augustiner Bräu beer garden, rubbing elbows with lederhosen-clad locals in a 17th-century monastery setting","1. Salzburger Nockerl: This fluffy, cloud-like soufflé is a local legend. Head to the historic St. Peter Stiftskulinarium for a picture-perfect rendition of this sweet treat.

2. Bosna: Forget fancy dining; this street food sausage is Salzburg's unsung hero. Grab one at Balkan Grill Walter, where they've been slinging these spiced bangers since the 50s.

3. Salzburger Bierfleisch: A hearty beer-braised beef stew that'll warm your soul. Try it at Goldene Kugel, where they pair it with pillowy bread dumplings.",,"157,166"
Samsun,41.29461,36.332060,SZF,Turkey,no,no,no,no,"Nestled on Turkey's Black Sea coast, Samsun is a vibrant port city that effortlessly blends history with modernity. This bustling metropolis, often overlooked by tourists, packs a punch with its lively waterfront promenade, dotted with trendy cafes and seafood restaurants serving up the catch of the day. History buffs will get their fix at the Archaeology and Atatürk Museum, while outdoor enthusiasts can hit the nearby Kızılırmak Delta for birdwatching or trek through the lush Akdağ mountains. Don't miss the chance to ride the nostalgic tram along Cumhuriyet Street, offering a charming glimpse into the city's past. With its friendly locals and laid-back vibe, Samsun is the perfect off-the-beaten-path destination for those seeking an authentic slice of Turkish coastal life.","• Soak up the sun and people-watch at Atakum Beach, Samsun's buzzing coastal hotspot
• Get your culture fix at the Archaeology and Ethnography Museum, home to ancient Hittite and Roman artifacts
• Hop on the nostalgic tram for a scenic ride along the Black Sea coastline
• Feast on pide (Turkish pizza) at the legendary Pideban restaurant in Çiftlik
• Take a day trip to the otherworldly Kızılırmak Delta, a bird-watcher's paradise teeming with flamingos and pelicans","1. Pide from Pidecilik Abidin: This boat-shaped Turkish pizza comes loaded with minced lamb, gooey cheese, and a runny egg – pure comfort food.

2. Terme pidesi at Pidem: A regional specialty, this crispy flatbread is topped with local butter and served piping hot. Simple, but oh-so-satisfying.

3. Hamsi tava at Balıkçı Hasan: Crispy Black Sea anchovies, lightly battered and fried to perfection. Best enjoyed with a squeeze of lemon and a cold beer.",,"600,000"
Sandefjord,59.07990,10.280432,ZYS,Norway,no,no,no,yes,"Nestled on Norway's southeastern coast, Sandefjord is a charming maritime gem that punches well above its weight. This compact city, once the whaling capital of the world, now lures visitors with its intoxicating blend of history and modernity. Stroll along the bustling harbor, where sleek yachts bob alongside traditional fishing boats, or dive into the city's fascinating past at the Whaling Museum. Foodies will swoon over the fresh seafood scene, while culture vultures can get their fix at the Midtåsen Sculpture Park. With its pristine beaches, vibrant cafe culture, and easy access to the stunning Vestfold archipelago, Sandefjord offers a perfect slice of Norwegian coastal life that's refreshingly off the beaten path.","• Dive into maritime history at the Whaling Museum, marveling at the full-size blue whale skeleton and trying your hand at virtual harpoon throwing

• Soak in the healing waters of Kurbadet, a chic Art Nouveau spa complex, before indulging in a Nordic-inspired massage treatment

• Sample local brews and tuck into gourmet burgers at Kokeriet Mikrobryggeri, a hip microbrewery housed in a former whale oil boiling plant

• Take a scenic fjord cruise to the picturesque island of Vesterøya, where you can kayak, swim, or simply laze on pristine beaches

• Stroll through the charming old town, popping into quirky boutiques like Cornelias Hus for Scandinavian design treasures, before settling in for a seafood feast at harbourside hotspot Brygga 11","1. Sandefjordsmør: This tangy, whipped butter sauce is the city's claim to fame. Try it drizzled over freshly caught cod at Kokeriet, a charming waterfront restaurant.

2. Hvalbiff: Controversial but traditional, whale steak is a local specialty. Head to Hvalkjøtt for a respectfully prepared, melt-in-your-mouth experience.

3. Sjømatsuppe: Warm up with a hearty seafood soup packed with local catch at Brygga 11, where the harbor views are as delicious as the food.",,"63,713"
